{
  "$schema": "http://json-schema.org/draft-07/schema#",
  "title": "Generated schema for Root",
  "type": "object",
  "properties": {
    "id": {
      "type": "string"
    },
    "name": {
      "type": "string"
    },
    "description": {
      "type": "string"
    },
    "status": {
      "type": "string"
    },
    "capabilities": {
      "type": "array",
      "items": {
        "type": "string"
      }
    },
    "features": {
      "type": "array",
      "items": {
        "type": "string"
      }
    },
    "config": {
      "type": "object",
      "properties": {
        "key": {
          "type": "string"
        }
      },
      "required": [
        "key"
      ]
    },
    "created_at": {
      "type": "string"
    },
    "updated_at": {
      "type": "string"
    },
    "provider_id": {
      "type": "string"
    },
    "persona_id": {
      "type": "string"
    },
    "user_id": {
      "type": "string"
    },
    "provider": {
      "type": "object",
      "properties": {
        "id": {
          "type": "string"
        },
        "name": {
          "type": "string"
        },
        "type": {
          "type": "string"
        },
        "description": {
          "type": "string"
        },
        "status": {
          "type": "string"
        },
        "features": {
          "type": "array",
          "items": {
            "type": "string"
          }
        },
        "agent_types": {
          "type": "array",
          "items": {
            "type": "string"
          }
        },
        "integration": {
          "type": "array",
          "items": {
            "type": "string"
          }
        },
        "config": {
          "type": "object",
          "properties": {
            "key": {
              "type": "string"
            }
          },
          "required": [
            "key"
          ]
        },
        "logo_link": {
          "type": "string"
        },
        "doc_link": {
          "type": "string"
        },
        "created_at": {
          "type": "string"
        },
        "updated_at": {
          "type": "string"
        }
      },
      "required": [
        "id",
        "name",
        "type",
        "description",
        "status",
        "features",
        "agent_types",
        "integration",
        "config",
        "logo_link",
        "doc_link",
        "created_at",
        "updated_at"
      ]
    },
    "persona": {
      "type": "object",
      "properties": {
        "id": {
          "type": "string"
        },
        "name": {
          "type": "string"
        },
        "description": {
          "type": "string"
        },
        "created_at": {
          "type": "string"
        },
        "updated_at": {
          "type": "string"
        }
      },
      "required": [
        "id",
        "name",
        "description",
        "created_at",
        "updated_at"
      ]
    },
    "users": {
      "type": "array",
      "items": {
        "type": "object",
        "properties": {
          "user_id": {
            "type": "string"
          },
          "agent_id": {
            "type": "string"
          },
          "user": {
            "type": "object",
            "properties": {
              "id": {
                "type": "string"
              },
              "first_name": {
                "type": "string"
              },
              "last_name": {
                "type": "string"
              },
              "email": {
                "type": "string"
              },
              "role": {
                "type": "string"
              },
              "created_at": {
                "type": "string"
              },
              "updated_at": {
                "type": "string"
              }
            },
            "required": [
              "id",
              "first_name",
              "last_name",
              "email",
              "role",
              "created_at",
              "updated_at"
            ]
          }
        },
        "required": [
          "user_id",
          "agent_id",
          "user"
        ]
      }
    },
    "domains": {
      "type": "array",
      "items": {
        "type": "object",
        "properties": {
          "domain_id": {
            "type": "string"
          },
          "agent_id": {
            "type": "string"
          },
          "domain": {
            "type": "object",
            "properties": {
              "id": {
                "type": "string"
              },
              "name": {
                "type": "string"
              },
              "type": {
                "type": "string"
              },
              "created_at": {
                "type": "string"
              },
              "updated_at": {
                "type": "string"
              }
            },
            "required": [
              "id",
              "name",
              "type",
              "created_at",
              "updated_at"
            ]
          }
        },
        "required": [
          "domain_id",
          "agent_id",
          "domain"
        ]
      }
    },
    "metrics": {
      "type": "array",
      "items": {
        "type": "object",
        "properties": {
          "id": {
            "type": "string"
          },
          "agent_id": {
            "type": "string"
          },
          "provider_id": {},
          "domain_id": {},
          "persona_id": {},
          "user_id": {},
          "metric_type": {
            "type": "string"
          },
          "metric_value": {
            "type": "number"
          },
          "unit": {
            "type": "string"
          },
          "created_at": {
            "type": "string"
          },
          "updated_at": {
            "type": "string"
          }
        },
        "required": [
          "id",
          "agent_id",
          "provider_id",
          "domain_id",
          "persona_id",
          "user_id",
          "metric_type",
          "metric_value",
          "unit",
          "created_at",
          "updated_at"
        ]
      }
    }
  },
  "required": [
    "id",
    "name",
    "description",
    "status",
    "capabilities",
    "features",
    "config",
    "created_at",
    "updated_at",
    "provider_id",
    "persona_id",
    "user_id",
    "provider",
    "persona",
    "users",
    "domains",
    "metrics"
  ]
}