{
	"id": "cm805787h000hqyasawcn6v4t",
	"name": "Agent 1",
	"description": "Agent 1 Description",
	"status": "ACTIVE",
	"capabilities": [
		"CAPABILITY_1",
		"CAPABILITY_2"
	],
	"features": [
		"FEATURE_1",
		"FEATURE_2"
	],
	"config": {
		"key": "value"
	},
	"created_at": "2025-03-08T11:50:04.109Z",
	"updated_at": "2025-03-08T11:50:04.109Z",
	"provider_id": "cm805786n0002qyasdm98tz9w",
	"persona_id": "cm8057876000bqyaszcrn7yhm",
	"user_id": "cm805786f0000qyasuvnbqfo9",
	"provider": {
		"id": "cm805786n0002qyasdm98tz9w",
		"name": "AWS",
		"type": "PLATFORMS",
		"description": "Amazon Web Services",
		"status": "ONLINE",
		"features": [
			"FEATURE_1",
			"FEATURE_2"
		],
		"agent_types": [
			"PLANNER",
			"EXECUTOR"
		],
		"integration": [
			"API"
		],
		"config": {
			"key": "value"
		},
		"logo_link": "https://aws.amazon.com/logo.png",
		"doc_link": "https://aws.amazon.com/documentation",
		"created_at": "2025-03-08T11:50:04.079Z",
		"updated_at": "2025-03-08T11:50:04.079Z"
	},
	"persona": {
		"id": "cm8057876000bqyaszcrn7yhm",
		"name": "Developer",
		"description": "Software Developer",
		"created_at": "2025-03-08T11:50:04.099Z",
		"updated_at": "2025-03-08T11:50:04.099Z"
	},
	"users": [
		{
			"user_id": "cm805786f0000qyasuvnbqfo9",
			"agent_id": "cm805787h000hqyasawcn6v4t",
			"user": {
				"id": "cm805786f0000qyasuvnbqfo9",
				"first_name": "John",
				"last_name": "Doe",
				"email": "john.doe@example.com",
				"role": "PLATFORM_ADMIN",
				"created_at": "2025-03-08T11:50:04.072Z",
				"updated_at": "2025-03-08T11:50:04.072Z"
			}
		}
	],
	"domains": [
		{
			"domain_id": "cm805786w0006qyasoxym0rwd",
			"agent_id": "cm805787h000hqyasawcn6v4t",
			"domain": {
				"id": "cm805786w0006qyasoxym0rwd",
				"name": "Software Development",
				"type": "SOFTWARE_DEVELOPMENT",
				"created_at": "2025-03-08T11:50:04.089Z",
				"updated_at": "2025-03-08T11:50:04.089Z"
			}
		}
	],
	"metrics": [
		{
			"id": "cm8057884000qqyas40f5vtjw",
			"agent_id": "cm805787h000hqyasawcn6v4t",
			"provider_id": null,
			"domain_id": null,
			"persona_id": null,
			"user_id": null,
			"metric_type": "CPU",
			"metric_value": 75.5,
			"unit": "%",
			"created_at": "2025-03-08T11:50:04.132Z",
			"updated_at": "2025-03-08T11:50:04.132Z"
		},
		{
			"id": "cm8057884000vqyas8uovkobx",
			"agent_id": "cm805787h000hqyasawcn6v4t",
			"provider_id": null,
			"domain_id": null,
			"persona_id": null,
			"user_id": null,
			"metric_type": "Memory",
			"metric_value": 70.8,
			"unit": "%",
			"created_at": "2025-03-08T11:50:04.132Z",
			"updated_at": "2025-03-08T11:50:04.132Z"
		}
	]
}